title,price,seller,location,discord,telegram
TH 13 - LVL 180+,150,Decoys,Location not specified,sgtteno,
"⭐Coc Gems | No login, No ban [Verified]",60,4Bom,"Bucharest, București, Romania",4bomstore,store4bom
Clan LvL 21 - Name: Avengers(10)- ( 632Wins - 212 Losses ),110,Phoenix,Location not specified,2015phoenix2015,
Web3: The Key to Unlocking a Revolutionary Crypto Exchange Platform,Make offer,Stevenryan,"Sivakasi, Tamil Nadu, India",,
TH 11 minimax,200,GWCOC,Location not specified,,
AR 55 8*5 Raiden Zhongli Ganyu Diluc More,60,Alpaszer,"Barranquilla, Atlántico, Colombia",alpaszer,
Canva Pro Admin Panel/Canva pro Owner/ ✅ 500 Members Panel/✅ For More Details Descroption,8.97,DIGIPULSE,"Dhaka, Dhaka Division, Bangladesh",,
| ⭐ NEW | Cheapest Gems on the market are back | Over 1000 orders,1000,Triple!!!,"Bucharest, Bucharest, Romania",Triple#6625,tripleto
"Hello, welcome to my Genshin Impact Boosting Services, my name is Syukio, i want to help some player",19,loudamisyanm,"Le Perreux-sur-Marne, Île-de-France, France",,
⚡ Primo Gems and Bundles ⚡No login needed | Not your regular top up service ⭐,2678,OctiPuss,"Bucharest, Ilfov, Romania",,
Crystals directly to UID Invoice is available for every region,60,To!agRo,"Bucharest, Bucharest, Romania",pikoneka,pikoneka
Blessing of the Welkin Moon (Only need user Id & server),3.9,Daemonstore,"Pecenongan, Jakarta, Indonesia",,
⭐ Cheap Crystals without login infos | Safe in-game purchases for gems and bundles,60,KamiShop,"Dumbravita, Timis, Romania",safetopup,
⭐Safe purchases of Genshin Crystals | Directly to UID,35,PaP@Bear,"Voluntari, Ilfov, Romania",papabearsupport,papabearsupport
TOPUP GENSHIN IMPACT CHEAP ONLY need UID 6480 = $73,Make offer,Sechan34,"Medan, North Sumatra, Indonesia",,
"⭐ Genshin Crystals | Safe, Fast & Secure [ NO LOGIN ]",55,TrooperTopper,"Bucharest, Bucharest, Romania",,
AR58 C6 RAIDEN ACCOUNT (36X5* CHARACTERS 16X5* WEAPS)/ 60% Exploration,Make offer,bachir98,"Belcourt, Algiers, Algeria",,
Genshin Crystals sent directly to UID without login,0,habile1,Location not specified,habilee,distr3ss
原神水晶,30,kiqshak65,"Ha Kwai Chung, Kwai Tsing, Hong Kong",,
Cheap Genshin Impact Crystals and Welkin Moon,Make offer,valakyn,"Singapore, Central Singapore, Singapore",,
8080 Genesis Crystals---No login--Safest-Any servers,85,LindR,china,ToyoxoGame#4299,@ToyoxoGame
Genshin Crystals sent directly to UID without login,75,Marg!NET,"Belgrade, Belgrade, Serbia",marg.net,marg.net
"⭐️ Direct Supplier Genshin Crystals | No login, No negative 100% safe",55,!TEK!,"Voluntari, Ilfov, Romania",#,#
[Verified] No login Genshin Crystals,65,TOPxTOPs,"Bucharest, București, Romania",topxtops,
Cheap Crystals | Trusted seller | Via UID,65,DupeGems,"Bucharest, București, Romania",dupegems,dupegems
Boost Service 100% 6 Map inazuma + Enkanomiya 100% + LV Max Electro Culus + LV Max Sakura Tree,32,wahyu islandi,indonesia,,
☀️ Talian's 456 Game Services Shop ✨ Genshin Impact Boosting Services ✨,Make offer,GamingPerson456,"Burgas, Burgas, Bulgaria",,
Genshin Impact Gift Bundle,3,Slloverr,Madrid,,
"ASIA/MALE/19* ZHONGLI C3, AYAKA, HUTAO, XIANYUN, XIAO ETC",30,AdamStalleon,"Tambora, Jakarta, Indonesia",,
AR56 genshin acc for sale,100,hotdogkitty,Netherlands,hotdogkitty#3077,
[Genshin NA starter store] 10000+ accounts in stock l Pick your perfect account,1,Elkido,Location not specified,https://playerup.com/UNrb2JA,
AR 11 hutao + mona C1 starter account *:･ﾟ✧*:･ﾟ✧,29,yuuwe,"Nyack, New York, United States",,
Genshin Impact Account,75,tqrtglia,"Overland Park, Kansas, United States",,
"[ASIA, AR 55]⭐️10 Leg Characters⭐️Raiden Shogun⭐️Neuvillett⭐️Navia⭐️Wanderer⭐️Qiqi⭐️Cyno⭐️Mona⭐️Jean",200,PikaAccounts,"Colombo, Western Province, Sri Lanka",,
AR 60 | 39 5-Star All Archons,110,Fikram,"Medan, North Sumatra, Indonesia",,
Genshin High ENDGAME ACCOUNTs Shop - Many Accounts Low-Middle-High Budget - -Get Yours today!,250,Dtafrtr,"Slatina, Olt, Romania",,
